title,text,authors,publish_time,url
Obesity and risk of respiratory tract infections: results of an infection-diary based cohort study, This supports arguments that the observed associations between obesity and RTI burden are due to physiological differences in the immune responsiveness between obese and non-obese individuals rather than lifestyle differences,"Maccioni, Livia; Weber, Susanne; Elgizouli, Magdeldin; Stoehlker, Anne-Sophie; Geist, Ilona; Peter, Hans-Hartmut; Vach, Werner; Nieters, Alexandra",2018-02-20,https://www.ncbi.nlm.nih.gov/pmc/articles/PMC5819164/
Human Metapneumovirus Infection in Jordanian Children: Epidemiology and Risk Factors for Severe Disease," Prematurity and daycare are underrepresented factors in this population, highlighting that factors contributing to severe disease differ substantially between geographic and developing regions
 Our study highlights that the epidemiology of established risk factors are unique to specific populations","Schuster, Jennifer E.; Khuri-Bulos, Najwa; Faouri, Samir; Shehabi, Asem; Johnson, Monika; Wang, Li; Fonnesbeck, Christopher; Williams, John V.; Halasa, Natasha",2015-12-01,http://europepmc.org/articles/pmc4875771?pdf=render
Does an Upper Respiratory Tract Infection During Pregnancy Affect Perinatal Outcomes? A Literature Review,Few data exist on the explicit topic of URTI and adverse perinatal outcomes,"Harris, Julia; Sheiner, Eyal",2013-01-30,https://www.ncbi.nlm.nih.gov/pmc/articles/PMC7088837/
Severe lower respiratory tract infection in infants and toddlers from a non-affluent population: viral etiology and co-detection as risk factors," Our data also reinforce previous findings that identified RSV as the major agent associated with severe LRTIs among children in a hospital setting, in populations of low socio-economic status, where other environmental and social variables potentially play a role [16, 17] ","da Silva, Emerson Rodrigues; Pitrez, Márcio Condessa Paulo; Arruda, Eurico; Mattiello, Rita; Sarria, Edgar E; de Paula, Flávia Escremim; Proença-Modena, José Luis; Delcaro, Luana Sella; Cintra, Otávio; Jones, Marcus H; Ribeiro, José Dirceu; Stein, Renato T",2013-01-25,https://www.ncbi.nlm.nih.gov/pmc/articles/PMC3598993/
Maternal Infection and Adverse Fetal and Neonatal Outcomes," These differences may reflect differences in study design, laboratory methodology, or population differences (race and socioeconomic status or size of study population), or case definition","Goldenberg, Robert L.; Culhane, Jennifer F.; Johnson, Derek C.",2005-09-30,https://doi.org/10.1016/j.clp.2005.04.006
