title,text,authors,publish_time,url
Social media engagement analysis of U.S. Federal health agencies on Facebook, Federal health agencies and Facebook users are meant to promote better healthcare knowledge through successful information dissemination and consumption,"Bhattacharya, Sanmitra; Srinivasan, Padmini; Polgreen, Philip",2017-04-21,https://www.ncbi.nlm.nih.gov/pmc/articles/PMC5401385/
The evidence base of primary research in public health emergency preparedness: a scoping review and stakeholder consultation, Opportunities for generating knowledge to examine complexities such as system integration could address knowledge gaps and inform operational activities and policy,"Khan, Yasmin; Fazli, Ghazal; Henry, Bonnie; de Villa, Eileen; Tsamis, Charoula; Grant, Moira; Schwartz, Brian",2015-04-28,https://www.ncbi.nlm.nih.gov/pmc/articles/PMC4415223/
"Surveillance, response systems, and evidence updates on emerging zoonoses: the role of one health"," Access to such resources addresses several barriers identified by health care decision makers regarding access to evidence-based information, including limitations of time and lack of knowledge regarding resources that synthesize, summarize, and assess evidence for quality","Asokan, G. V.; Kasimanickam, Ramanathan K.; Asokan, Vanitha",2013-12-13,https://www.ncbi.nlm.nih.gov/pmc/articles/PMC3864162/
Fading vision: knowledge translation in the implementation of a public health policy intervention,Intra-organizational networks and communications are important influences on successful implementation,"Tomm-Bonde, Laura; Schreiber, Rita S; Allan, Diane E; MacDonald, Marjorie; Pauly, Bernie; Hancock, Trevor",2013-06-04,https://www.ncbi.nlm.nih.gov/pmc/articles/PMC3680003/
Pandemic planning in pediatric care: A website policy review and national survey data," They identified concerns from resource allocation to ethical decision-making, illustrating the complexity and heterogeneity of these issues","Nicholas, David; Patershuk, Clare; Koller, Donna; Bruce-Barrett, Cindy; Lach, Lucy; Zlotnik Shaul, Randi; Matlow, Anne",2010-07-31,https://doi.org/10.1016/j.healthpol.2010.01.007
