title,text,authors,publish_time,url
Evaluation of Public Health Emergency Management in China: A Systematic Review,"China's comprehensive promotion of health infrastructure construction requires improvement of disaster prevention, mitigation/emergency response capabilities, and improvement of the emergency health emergency response system","Wang, Jia; Yuan, Beibei; Li, Zhengmao; Wang, Zhifeng",2019-09-18,https://www.ncbi.nlm.nih.gov/pmc/articles/PMC6766041/
Moving towards a new vision: implementation of a public health policy intervention, Municipal fiscal issues impacted the budgets of local public health units,"Valaitis, Ruta; MacDonald, Marjorie; Kothari, Anita; O’Mara, Linda; Regan, Sandra; Garcia, John; Murray, Nancy; Manson, Heather; Peroff-Johnston, Nancy; Bursey, Gayle; Boyko, Jennifer",2016-05-17,https://www.ncbi.nlm.nih.gov/pmc/articles/PMC4869271/
Leveraging the Laboratory Response Network Model for the Global Health Security Agenda," In the face of these challenges, the LRN employed the existing public health infrastructure as the backbone of its network and rebuilt it through funds awarded to states by HHS's CDC Cooperative Agreement on Public Health Preparedness and Response for Bioterrorism (now called the Public Health Emergency Preparedness [PHEP] Cooperative Agreement)","Mangal, Chris N.; Maryogo-Robinson, Lucy",2014-09-01,http://europepmc.org/articles/pmc4171117?pdf=render
Communications in Public Health Emergency Preparedness: A Systematic Review of the Literature," 6 Communication to the public is critically important in public health emergency preparedness
 5 The model is a heuristic framework developed to link social determinants with preparedness outcomes through public health emergency preparedness communications
 Viswanath and colleagues developed an explanatory framework of how inequalities in public health emergency preparedness outcomes attributable to social determinants could potentially be explained by inequalities on various dimensions of public health emergency preparedness","Savoia, Elena; Lin, Leesa; Viswanath, Kasisomayajula",2013-09-01,http://europepmc.org/articles/pmc3778998?pdf=render
