title,text,authors,publish_time,url
Health security capacities in the context of COVID-19 outbreak: an analysis of International Health Regulations annual report data from 182 countries,"3-financing mechanism and funds for timely response to public health emergencies Availability and accessibility of financing mechanisms is essential for prevention, detection, and control of infectious disease outbreaks
 24 An effective way of managing airborne infections is applying evidence-based public health prevention strategies
Effective response to outbreaks and other health emergencies depends on case management
Capacity for infection prevention and control is needed for effective case management and infection control
 Infection prevention and control at the community and healthcare facility level is key for prevention, control and containment of the infection
Access to the essential health services are needed to prevent, detect, and control infectious disease outbreaks
Capacity for verification, risk assessment, and analysis investigation is crucial for the prevention, detection, and control of infectious disease outbreaks","Kandel, Nirmal; Chungong, Stella; Omaar, Abbas; Xing, Jun",2020-03-18,https://doi.org/10.1016/s0140-6736(20)30553-5
Social Media and Internet-Based Data in Global Systems for Public Health Surveillance: A Systematic Review,Regulating the identification of disease outbreaks and other emergencies with potential international public health implications also requires technical advice to develop adequate surveillance activities,"VELASCO, EDWARD; AGHENEZA, TUMACHA; DENECKE, KERSTIN; KIRCHNER, GÖRAN; ECKMANNS, TIM",2014-03-01,http://europepmc.org/articles/pmc3955375?pdf=render
