title,text,authors,publish_time,url
Evaluation of Public Health Emergency Management in China: A Systematic Review,"China's comprehensive promotion of health infrastructure construction requires improvement of disaster prevention, mitigation/emergency response capabilities, and improvement of the emergency health emergency response system
Health emergency management assessment is a process of formulating objective judgments on assessment targets based on specific criteria","Wang, Jia; Yuan, Beibei; Li, Zhengmao; Wang, Zhifeng",2019-09-18,https://www.ncbi.nlm.nih.gov/pmc/articles/PMC6766041/
Establishment of CDC Global Rapid Response Team to Ensure Global Health Security, CDC response mechanisms can be further improved through continued coordination with agency emergency response personnel and streamlined mobilization processes,"Stehling-Ariza, Tasha; Lefevre, Adrienne; Calles, Dinorah; Djawe, Kpandja; Garfield, Richard; Gerber, Michael; Ghiselli, Margherita; Giese, Coralie; Greiner, Ashley L.; Hoffman, Adela; Miller, Leigh Ann; Moorhouse, Lisa; Navarro-Colorado, Carlos; Walsh, James; Bugli, Dante; Shahpar, Cyrus",2017-12-27,https://www.ncbi.nlm.nih.gov/pmc/articles/PMC5711298/
The evidence base of primary research in public health emergency preparedness: a scoping review and stakeholder consultation," Emergency preparedness research focused on all aspects of the emergency management cycle (prevention/mitigation, preparedness, response and recovery) was considered","Khan, Yasmin; Fazli, Ghazal; Henry, Bonnie; de Villa, Eileen; Tsamis, Charoula; Grant, Moira; Schwartz, Brian",2015-04-28,https://www.ncbi.nlm.nih.gov/pmc/articles/PMC4415223/
"Regulatory Underpinnings of Global Health Security: FDA's Roles in Preventing, Detecting, and Responding to Global Health Threats","The mitigation of emerging and ongoing public health emergency threats often requires the use of MCMs
Legal and regulatory authorizations to facilitate MCM product availability are also vital to early mitigation of disease outbreaks and other public health threats","Courtney, Brooke; Bond, Katherine C.; Maher, Carmen",2014-09-01,http://europepmc.org/articles/pmc4171126?pdf=render
"Surveillance, response systems, and evidence updates on emerging zoonoses: the role of one health", Emerging zoonoses causes serious health threats and global economical losses,"Asokan, G. V.; Kasimanickam, Ramanathan K.; Asokan, Vanitha",2013-12-13,https://www.ncbi.nlm.nih.gov/pmc/articles/PMC3864162/
Communications in Public Health Emergency Preparedness: A Systematic Review of the Literature," It helps mitigate the risks, supports the implementation of protective actions, and contributes to minimizing negative mental health impacts of disasters","Savoia, Elena; Lin, Leesa; Viswanath, Kasisomayajula",2013-09-01,http://europepmc.org/articles/pmc3778998?pdf=render
