title,text,authors,publish_time,url
Public health human resources: a comparative analysis of policy documents in two Canadian provinces," Public health units are not part of the Local Health Integration Networks (regional health authorities) in ON
 Public health is integrated into the larger health care system","Regan, Sandra; MacDonald, Marjorie; Allan, Diane E; Martin, Cheryl; Peroff-Johnston, Nancy",2014-02-24,https://www.ncbi.nlm.nih.gov/pmc/articles/PMC3936858/
Investigating public health emergency response information system initiatives in China,"The public health regulatory system is insufficient
 A standard national public health emergency reporting platform with an underlying central database was implemented
 The Chinese central and local governments have appropriated sizable financial resources to build a public health emergency response information system (PHERIS)","Liang, Huigang; Xue, Yajiong",2004-09-30,https://doi.org/10.1016/j.ijmedinf.2004.05.010
