title,abstract,text,similarity
The International Health Regulations: The Governing Framework for Global Health Security,"r The International Health Regulations (IHR) are the governing framework for global health security yet require textual and operational reforms to remain effective, particularly as parallel initiatives are developed.","The IHR's origins can be traced to a series of Sanitary Conferences beginning in 1851 to forge an international agreement to curb the spread of infectious diseases (originally cholera, followed by plague and yellow fever) entering Europe from Asia, particularly India and the Levant. 10 At that time, the concept of global health security meant protecting Europe without unduly hindering trade. The Sanitary Conferences led to a binding agreement in 1892-the International Sanitary Convention (ISC)-focused on quarantine for cholera. European states subsequently adopted additional conventions, which were incorporated into a single ISC. By 1926, the ISC covered primarily cholera, yellow fever, and plague. The raison d'être of the earliest treaties grew out of a perceived security imperative for powerful countries. Most important was selfprotection against external threats, rather than safeguarding the public's health in every region of the world.

In 1907, the Rome Agreement created the Office International d'Hygiène Publique (OIHP), entrusting this new agency with overseeing the international health agreements. 11 At its creation in 1948, the WHO assumed OIHP's mandate and oversight of the ISC as well as a separate convention on air travel. The WHO Constitution empowered the Organization to adopt regulations to prevent the international spread of disease (Articles 21, 22) . Its power to adopt regulations is far-reaching-binding on Member States unless they affirmatively opt out. 12 In 1951, the WHA exercised this authority to replace the ISC with the International Sanitary Regulations (ISR), covering 6 diseases. In 1969, the WHA revised the ISR, changed their name to the International Health Regulations, and removed typhus and relapsing fever. The WHA removed smallpox in 1981 after its global eradication. By the time the WHA called for fundamental revision of the IHR in 1995, the treaty applied to the same 3 diseases as the original ISC-cholera, plague, and yellow fever-and no others. hemorrhagic fever, it became clear that the IHR were insufficiently flexible to respond to new infectious disease threats. The WHA called for the IHR's revision in 1995, and subsequent resolutions in 2001 and 2002 brought critical attention to the early detection of, and rapid response to, public health threats; yet the WHA took little action to shore up the obvious weaknesses in the IHR. [13] [14] [15] The imperative for global health governance took on fresh urgency with the advent of severe acute respiratory syndrome (SARS). Although SARS cases emerged in November 2002, China delayed notifying the WHO until February 2003. China took 2 additional months before permitting WHO epidemiologists to enter Guangdong province, where the outbreak originated. Later, Beijing conceded it had experienced hundreds more cases than previously reported. 16 Then WHO Director-General Gro Harlem Brundtland criticized China's delays, 17 catalyzing a major political shift toward a global norm of transparency and prompt reporting, further driving IHR reform. 18 The WHA adopted the revised IHR in 2005, with the treaty entering into force in 2007. Currently, the IHR have 196 States Parties-every WHO Member plus Lichtenstein and the Holy See. 19 

The revised IHR aim ""to prevent, protect against, control and provide a public health response to the international spread of disease"" (Article 2). The IHR broke from a disease-specific model, embracing an ""all-hazards"" strategy. They define ""disease"" to include all illnesses or medical conditions, irrespective of origin or source, that could present significant harm to humans (Article 1). The drafters intended to incorporate biological, chemical, and radio-nuclear events, as well as zoonotic diseases and threats to food safety.

Recognizing the importance of travel and commerce, the IHR contain a ""balancing dynamic,"" comprising public health, commerce and human rights (Figure 1 ). This balance informs the health measures a State Party may take for international travelers upon their arrival and departure (eg, medical examinations, vaccinations, observation) and for keeping ships and aircraft free of contamination and disease vectors. States Parties must, though, have sufficient scientific evidence of the risk posed and of whether the measure adopted is likely to ameliorate that risk before taking restrictive travel or trade measures or impinging The IHR obligate States Parties to develop core capacities to detect, assess, report, and respond to potential public health emergencies of international concern. The IHR (Annex 1) prescribe explicit capacities for surveillance and response and for controlling and containing disease at points of entry. The IHR identify minimum core capacities required at the local, intermediate (regional/provincial), and national levels to detect unexpected morbidity and mortality, report essential information, confirm and assess the status of reported events, notify the WHO when required (following the decision algorithm in Annex 2), and respond effectively to contain and mitigate the event.

To guide States Parties in developing IHR core capacities, the WHO published the IHR Core Capacity Monitoring Framework in 2010 (subsequently updated). 20 The IHR Monitoring Framework and accompanying IHR Monitoring Tool identified 8 specific core capacities, as well as 5 other capacities concerning points of entry and specific hazards ( Figure 2 ). For each of these 13 core capacities, the WHO identified attributes and actions, asking states to use these attributes to assess their compliance.

The concept of core capacities embraced an ""upstream"" public health strategy to prevent and contain outbreaks at their source. States Parties agreed ""to collaborate with each other to the extent possible"" to develop and maintain core capacities (Article 44). States Parties were required to develop and maintain core capacities by 2012, with a possible extension to 2014, and an additional extension to 2016. In 2015, the 68 th WHA extended the deadline to 2016 for all 81 States Parties that had requested extensions. The WHA also decided to support 60 priority countries, including those in west and central Africa, to meet core capacities by June 2019 3 ( Figure 3 ). Still, the Organization's pattern has been to accept continual delays in State Party compliance.

In line with their historical origins, the IHR contain rules regarding points of entry at ground, air, and water borders, as well as health measures for conveyances, goods, containers, and travelers. Further, States Parties must apply health measures in a nondiscriminatory manner, justify additional measures, collaborate with other states, and treat personal data confidentially. States Parties must report to the WHO on their IHR implementation and comply with prescribed dispute resolution procedures. Importantly, the IHR also set up new mechanisms for twoway communication and information sharing between the WHO and States Parties. The IHR mandate that each State Party appoint a National IHR Focal Point (NFP) for routine information sharing and coordination during health crises. All states have NFPs, at least on paper, but many NFPs either are not well trained in IHR implementation or-more often-are not properly tasked to routinely communicate with WHO headquarters.

The IHR require States Parties to promptly notify the WHO of events that may constitute a public health emergency of international concern (PHEIC) with an ongoing obligation to inform and respond to follow-up requests ( Figure 4 ). Notifications alert the world to unfolding public health events as well as marshal resources and coordinate global response efforts. To guide notifications, Annex 2 contains a decision instrument requiring States Parties to always notify the WHO of 4 specific diseases: smallpox, wild poliomyelitis, novel human influenza, and SARS. The algorithm also lists pandemic-prone diseases that trigger further assessment, including cholera, pneumonic plague, yellow fever, and viral hemorrhagic fevers. Beyond listed diseases, States Parties must utilize the instrument to assess any event of potential international public health concern, including from unknown causes, to determine if it is unusual or unexpected, may cross boarders, or may require travel or trade restrictions (Annex 2). Departing from previous international norms, the IHR authorize the WHO to consider reports from unofficial sources, such as scientists, nongovernmental organizations (NGOs), print and broadcasting outlets, and social media platforms. When it receives an unofficial report, the WHO seeks verification from the States Parties in whose territory the event occurs. The director-general (D-G) has sole power to declare a PHEIC. In determining whether to declare a PHEIC, the D-G shall consider: (a) information provided by the State Party; (b) the decision instrument; (c) the advice of the Emergency Committee, which the D-G also has sole discretion to convene; (d) scientific principles and evidence; and (e) a risk assessment regarding human health, international spread, and interference with international traffic. If the D-G declares a PHEIC, she must issue temporary, nonbinding recommendations describing health measures States Parties should take. She is also empowered to terminate a PHEIC, which automatically expires after 3 months unless extended, modified, or terminated earlier.

Declared PHEICs. The 2009 H1N1 influenza pandemic put the IHR to the test. The WHO declared the first-ever PHEIC after consultation with Mexico and the United States. 21 The WHO, however, was later criticized for fueling public fear when it became clear the virus was not highly pathogenic (although it still caused more than 200,000 deaths worldwide), 22 but that criticism was primarily aimed at WHO's then definition of the pandemic influenza phases, which stood outside the IHR framework. Many States Parties also disregarded the WHO's temporary recommendations against travel and trade restrictions; several states banned pork imports, while others instituted travel restrictions and advisories. 23, 24 In 2011, the WHO Review Committee charged with reviewing IHR functioning during the H1N1 pandemic cautioned, ""The world is ill-prepared to respond to a severe influenza pandemic . . . with tens of millions at risk of dying."" 25 In 2014, the D-G declared 2 further PHEICs, for polio and for Ebola. The designation of polio appeared counterintuitive given there was only a handful of cases. Yet small pockets of polio in Afghanistan, Pakistan, and Nigeria were putting global eradication at risk. The following year, the WHA endorsed extension of the PHEIC given political instability in the regions with ongoing outbreaks. 26 The polio PHEIC declaration is untraditional, appearing more to rally political support in targeted states than to alert the world to any large-scale reemergence of the disease.

In the case of Ebola, the D-G waited 4 months after announcing an ""unprecedented outbreak"" in April 2014 before declaring a PHEIC on August 8, 2014. 27 The delay only looked worse with time, as leaked WHO documents revealed that the WHO's decisions were highly political and lacked transparency. 28 The WHO's Ebola Interim Assessment Panel in July 2015 said that urgent warnings ""either did not reach senior leaders or senior leaders did not recognise their significance."" 2 The Harvard-LSHTM Independent Panel on the Global Response to Ebola wrote, ""Confidence in the organization's capacity to lead is at an alltime low."" 4 The temporary recommendations also suffered major flaws of their own, asking states with limited infrastructure to ensure health system capacities without adequate international assistance. 29 The Ebola PHEIC declaration, though, ultimately rallied the international community to bring the epidemic under control, but not before it had claimed more than 11,300 lives. 30 Most notably, President Obama sent in military assets to build treatment facilities and provide logistical support; the UN Security Council (UNSC) adopted a historic resolution calling Ebola a threat to international peace and stability; and the UN Secretary-General created a UN Mission for Ebola Emergency Response (UNMEER). Although the D-G continued the PHEIC on December 18, 2015, human-to-human transmission has virtually ended in the 3 most affected countries. This robust, albeit delayed, response demonstrates that political resolve and ample financing can bring seemingly intractable health threats under control.

On February 1, 2016, the D-G declared the fourth, and most recent, declaration of a PHEIC in response to the Zika epidemic. 31, 32 Since Brazil reported Zika in May 2015, an estimated 1 million infections have occurred across 25 countries in the Americas. IHR NFPs throughout the Americas have been reporting laboratoryconfirmed cases of Zika to the Pan American Health Organization (PAHO), which has issued recommendations for the region. 33 Most concerning is a possible association between Zika virus and neurological disease (Guillain-Barré syndrome [GBS]) or fetal abnormalities (microcephaly). Curbing the Zika epidemic will require effective vector control, mosquito and human surveillance, and research for reliable diagnostic tests and a vaccine. The US Centers for Disease Control and Prevention advised pregnant women to postpone travel to Zika-affected countries. Women who are considering becoming pregnant should talk with their doctor. 34 This is the first time the D-G has declared a PHEIC for a mosquitoborne disease, but the scope of the declaration was narrower than for other PHEICs. Dr. Margaret Chan said, ""I am now declaring that the recent cluster of microcephaly cases and other neurological disorders reported in Brazil, following a similar cluster in French Polynesia in 2014, constitutes a Public Health Emergency of International Concern."" 35, 36 In other words, the PHEIC was for the cluster of microcephaly and GBS rather than for the Zika virus itself. From a legal perspective, the wording of the PHEIC introduces confusion as neither microcephaly nor GBS is an infectious disease. These neurological and congenital conditions per se do not appear to be hazards that could cross borders under the meaning of Annex 2. It is the Zika virus itself and the mosquito vector that have the potential for international transmission.

Undeclared and Potential PHEICs. The world is now closely watching outbreaks of Middle East respiratory syndrome (MERS), which originated in Saudi Arabia in 2012. MERS has yet to trigger a PHEIC declaration despite its reaching more than two dozen countries and accounting for at least 1,621 laboratory-confirmed cases and 584 deaths as of December 2015. 37, 38 By September 2015, the D-G had convened 10 Emergency Committee meetings, 39 with the last two occurring during and after the spread of the virus from Saudi Arabia to the Republic of Korea, which sparked a large outbreak. 40 The Emergency Committee recommended careful monitoring and strengthened infection prevention and control. Most MERS cases were linked to hospital settings, and in the absence of sustained community transmission, the Committee concluded the conditions to declare a PHEIC had not been met. 41 For many global health crises, the D-G chose not even to convene an Emergency Committee, including cholera in Haiti, the Fukushima nuclear disaster in Japan, and chemical weapons use in Syria. Each event would have required notification under Annex 2, in addition to the several hundred events that have been reported to the WHO as potential PHEICs. Confusion still exists as to what events warrant consideration by an Emergency Committee and a potential PHEIC declaration. What steps can and should the WHO take to ensure prompt notification and information sharing, and how can the D-G improve the transparency and scientific rigor for declaring a PHEIC?

The IHR afford a vital governing framework to limit the international spread of disease. Yet, 10 years of experience has shed light on the critical challenges in implementing the IHR, as well as major omissions in the regulations. These challenges and gaps have become politically salient, with deepening concern that the IHR, and the WHO itself, have failed to fulfill the promises of sound governance and leadership. The past decade has revealed an urgent need to improve the IHR's text, but failure to effectively implement the regulations has become far more important. States Parties, in particular, have undermined the IHR's effectiveness by failing to fully comply with their international obligations. Below, we explain the gaps and features of noncompliance that have undermined the IHR's operational viability.

National core capacities for preparedness, detection, and response form the bedrock of global health security. 42 Yet most States Parties have yet to fully establish core capacities. In 2014, only 64 States Parties reported meeting core capacities, while 48 failed even to respond to the WHO 43(p6) ( Figure 5 ). Governments have not properly funded and implemented required capacities, while international assistance has been limited. 43(p6) Achieving IHR core capacities by all states remains an indisputable baseline for global health security. The more time it takes to detect an event, the slower the response is and the more lives are lost. Every WHO IHR Review Committee and all the major commissions ( Table 1 ) have demanded that States Parties build and strengthen core capacities-all to little avail. 2,43(p12,13) Finding the resources to support health system capacity building has been challenging. While States Parties committed to providing domestic resources to build core capacities, national budgets often neglect this fundamental commitment under the IHR. Many countries with limited resources have had little bandwidth to prioritize building systems for unknown threats as they have struggled to meet the everyday health needs of their populations-ranging from primary care and essential medicines to safe childbirth and healthy mothers and babies. Similarly, the WHO and higher-income States Parties agreed to provide technical and financial assistance to countries in need (Article 44), but with some exceptions, 44,45 very few have funded projects explicitly for building IHR core capacities. The bulwark of international financing has been in the form of vertical funding streams, such as for AIDS, tuberculosis, and malaria. All in all, sustainable funding commensurate with the need for IHR core capacities has come neither from national governments nor from donors.

Through the IHR Monitoring Tool, the WHO expects States Parties to conduct annual self-assessments on IHR implementation, focusing on the 13 core capacities. States were supposed to issue formal reports in 2012 (with additional reports in 2014 and 2016 for governments that requested extensions) to declare if they had fully implemented the regulations. If not, countries were supposed to submit a concrete plan to reach full implementation. Even if all States Parties had reported accurately and in a timely manner, national self-assessments are unacceptable and cannot ensure uniformly high-quality national preparedness. States Parties have not collected sufficient or the right kinds of data to produce quantitative assessments of what are predominately qualitative questions. Governments, moreover, do not use a consistent set of evidence-based metrics to measure their compliance. Most importantly, self-assessments are inherently self-interested and unreliable, absent rigorous independent validation. These deficiencies undermine the integrity and utility of self-assessments. 43(p6) Beyond the failure of political will, country assessments have not been directly linked to robust technical and financial assistance. Lowerincome states, perhaps understandably, express reluctance to upgrade their capacities without such assistance. Overall, responsibility for fulfilling core capacities must be a shared one, requiring dedicated domestic budgets, international financing, and WHO leadership. And absent these political and financial commitments to build core capacities, the world is considerably less secure.

Although the IHR call for robust information sharing through reporting of potential PHEICs and subsequent requests for follow-up data, countries continue to delay notifications and/or limit the information reported. Delayed reporting and/or lack of transparency and cooperation, for example, occurred in West Africa during Ebola and in Saudi Arabia during MERS. Additionally, governments have failed to share pertinent information about international travelers, either out of defiance of their international obligations or simply due to confusion about patient privacy-all despite guidance under Article 45.

The extant governance framework reveals an inherent tension, providing a disincentive to transparency and information sharing. The IHR cannot effectively govern global health security unless governments promptly report novel infections. This follows the simple pattern of the epidemiologic curve: the faster health authorities know about a novel event, the faster they can mount an effective response, leading to fewer cases ( Figure 6 ). But governments have economic reasons to withhold or delay transparent information sharing. They fear that once they have disclosed an outbreak of a novel infection, other governments and private parties may impose travel and trade restrictions, with severe economic consequences. For example, once they have disclosed, the IHR Emergency Committee could conclude that travel and trade restrictions are warranted; or, more likely, governments or the private sector may simply take action, disregarding WHO recommendations. The adverse economic impact of early reporting under the IHR can dissuade States Parties from being fully transparent.

Given previous patterns, national concern about the economic repercussions of prompt reporting appears fully justified. Guinea, Sierra Leone, and Liberia, for example, experienced aggregate cumulative losses over 10% of GDP due to the Ebola outbreak. 46 Canada during SARS as well as Mexico and the United States during H1N1 suffered major losses from precipitous reductions in tourism and trade. Yet, the failure [and] that have the potential for such catastrophic economic impact."" The Commission estimates that a pandemic in the 21 st century could cost in excess of US$6 trillion. 5 Despite the severe health and economic repercussions of unnecessary travel and trade restrictions, the WHO has not had the political authority or capacity to prevent States Parties from disregarding its recommendations. The WHO is not a policing agency, and the IHR offer scant inducements to ensure consistent State Party compliance. When countries balance their IHR obligation to report against the risk of economic sanctions, they may wait as long as possible before sharing vital information.

The Ebola epidemic highlighted major deficiencies in mobilizing a large-scale, coordinated response to health emergencies. The IHR provide a framework for global health security, but that framework functions only if the WHO is an effective leader and governments build strong health systems. The WHO erred at multiple levels during the Ebola epidemic. The D-G waited 5 months after cross-border spread before declaring an emergency. The WHO Regional Office for Africa (AFRO) and country offices impeded deployment of international aid workers and equipment. Most importantly, the WHO failed to mobilize adequate fiscal and human resources until the epidemic was spinning out of control. The Organization eventually corrected these mistakes, but its errors probably cost thousands of lives. The fault lies, in fairness, not only with the WHO Secretariat but also with Member States that have starved the agency of resources for many years.

The reasons for the WHO's failures are well understood but remain resistant to change. In 2011, the agency cut its budget by nearly US$600 million due to a severe fiscal deficit, notably its epidemic response capabilities. 47 Its regional structures have also been longstanding problems, with major variability in regional organizations. The D-G has called on governments and donors to build core capacities and has asked for State Party compliance with the IHR, but without impact. 48 All the Ebola commissions have exhibited an implicit distrust in the Organization to make the necessary reforms. Instead, each panel has proposed a well-funded and accountable WHO Centre for Emergency Preparedness and Response. The Harvard-LSHTM Independent Panel on the Global Response to Ebola, for example, insisted that a new center be quasi-independent, with a separate governing board ( Table 2) .

The WHO is the agency charged with overseeing the IHR. Without effective leadership, the IHR's security framework breaks down. In other words, a strong treaty text is insufficient without a well-funded and robust operational response.

When the revised IHR were negotiated, Member States aimed to be as inclusive of all public health threats as possible. However, there remained major omissions in the text, notably sample sharing and zoonotic threats. The secretary-general should initiate the integration of health and humanitarian crises trigger systems.

The WHO should establish a transparent and politically protected Standing Emergency Committee. 

Indonesia sent shock waves around the world in December 2006, when its minister for health, Siti Fadilah Supari, refused to share samples of avian influenza A (H5N1) with the WHO. Indonesia's decision revealed fissures within the international community. Developing countries backed Indonesia's claim that it was unfair to require sharing viruses without any reciprocal obligation to make vaccines and medicines affordable. The WHO led a 5-year negotiation resulting in the 2011 Pandemic Influenza Preparedness (PIP) Framework. 49 The PIP Framework, however, applies only to pandemic influenza, and not to other novel pathogens such as SARS, MERS, and Zika. The PIP Framework stands entirely outside the IHR. The regulations, furthermore, are mostly silent on the health security issues of sharing biological materials and genetic sequencing data (GSD), as well as equitable access to medical countermeasures. Article 6(2) of the IHR, however, does offer some guidance for information sharing, stating that States Parties shall continue to provide relevant public health information to the WHO following a potential PHEIC notification, including case definitions, laboratory results, source and type of risk, number of cases and deaths, conditions affecting spread, and the health measures that have been deployed. There is no explicit mention of sharing biological materials or GSD, even though one could broadly interpret Article 6(2) to encompass these data. Certainly, biological materials and GSD are pertinent public health information that would shed light on the conditions affecting the spread of disease.

Neither the IHR nor the PIP framework, moreover, addresses a modern biosecurity hazard. In the not-too-distant future, scientists will be able to sequence the genetic composition of pathogens, enabling them to re-create novel viruses and to manipulate their genetic makeup. Although, for example, smallpox has been eradicated, scientists can sequence its genome, synthesize a real smallpox virus using the genetic code, and potentially enhance the virus's ability for airborne transmission. These capabilities pose major biosecurity threats, which the IHR and the PIP Framework do not govern. Harmonizing the IHR and the PIP Framework and closing major coverage gaps would markedly improve health security.

Approximately 70% of all emerging infectious diseases have a zoological origin, yet negotiators intentionally did not explicitly include animal diseases in the IHR. The drafters were perhaps too deferential to existing regimes, such as the World Organisation for Animal Health (OIE) and the UN Food and Agriculture Organization (FAO). Although the IHR broadly define ""disease,"" its currently realized scope is narrow, and the regulations do not incorporate a ""One Health"" approach that fully integrates animal and human health systems. The lack of such an approach could become a particularly salient omission for diseases like Zika with large animal reservoirs and with the primary mode of transmission through an insect source.

The IHR Monitoring Framework seeks to include zoonotic diseases as ""other hazards,"" but the regulations fail to govern multisectoral engagement and coordination on zoonotic diseases or the laboratory and surveillance capacities required to identify disease in animals. As the world faces the peril of novel zoonotic diseases and the overuse of antibiotics in both humans and animals (exacerbating the global antimicrobial-resistance crisis), it appears anomalous that the IHR do not facilitate and guide research and practice at the intersection of human and animal health.

The IHR are the governing framework for global health security, yet they require textual and operational reforms. The WHO Secretariat is engaged in an internal reform process, ranging from the WHO Roadmap for Action on Ebola 3 to the Advisory Group on Reform of WHO's Work in Outbreaks and Emergencies with Health and Humanitarian Consequences. 50 In addition to the Ebola Interim Assessment Panel, 2 the agency established the WHO Review Committee on the Role of the IHR in the Ebola Outbreak and Response. 51 On January 30, 2016, the D-G announced internal reforms, including a single program and incident management strategy to oversee all health emergencies. The D-G stressed, however, yet again, that the program required sustainable funding from Member States. 52 The proliferation of internal and external reform processes could be transformative. This is ""the defining moment for the health of the global community."" 2 Yet, it is just as likely that the maze of recommendations will lead to weak or muddled reforms. In the sections that follow we offer proposals for fundamental reform of IHR implementation, WHO oversight, and State Party conformance (Table 3) . We propose politically feasible pathways to reform to avoid a long history of bureaucratic stagnation. Thus, our proposals balance the ideal with the politically possible.

Meeting IHR core capacities requires mutual responsibility and accountability. It starts with governments dedicating resources to build and sustain health systems. Every State Party should undergo independent, rigorous review of its implementation of IHR core capacities, using measurable metrics and targets, as explained below. Shared responsibilities also require technical assistance and international financing to close capacity gaps. Collective security is assured only by fulfilling these mutual obligations to sustainably build, measure, and finance health systems (Figure 7) .

Building sustainable core capacities requires fresh thinking by both donors and recipient countries. Too often, countries heavily dependent on external funding follow the priorities of donors, agreeing to erect vertical programs, stove-piped by disease. Yet, meeting IHR core capacities requires the development of horizontal programs, including diagnostic laboratories that can be used for more than just one pathogen or condition; specimen transport systems that are applicable to all samples; and event-based surveillance systems designed to pick up unusual or unexpected public health events. Building core capacity also requires integrating these systems into annual budgeting for health system strengthening.

For IHR metrics to be meaningful, valued, and utilized, they must undergo rigorous external evaluations. The WHO should establish an independent evaluation system with a feedback loop and continuous quality improvement. Independent assessments would use evidence-based metrics and indicators. Unless assessment criteria are clear, transparent, and valid, they will not be fully trusted. The measurable benchmarks for the external assessment process, moreover, should be integrated directly into Annex 1 of the IHR, which contains the core capacity requirements for surveillance and response. It may be necessary either to amend Annex 1 or to operationalize it to incorporate more granular indicators. 

Political Mechanism

Capacities Secure national and global commitment to build, strengthen, and maintain IHR core capacities linked directly to independent assessments and financing.

National governments, international organizations, bilateral donors, and funding organizations

Global health security is dependent on every nation having the ability to detect, assess, report, and respond to public health emergencies.

No textual change to IHR required for commitment to core capacities Political and financial commitment to support process required by the WHO and other funding entities, such as the World Bank and regional development banks Table 3 .

Independently Assessed Metrics Utilize rigorous metrics assessed by independent evaluators to identify capacity gaps, develop a road map, and identify funding sources to achieve core capacities.

Independent evaluation teams of domestic and external experts with the participation of the WHO, regional and country offices, and civil society

Independently assessed, vigorous metrics will provide accurate analysis of national core capacities that can then be used by funding entities to invest in core capacities or for use in insurance mechanisms.

Tasking the WHO to work with funding entities to create rigorous metrics and organize assessments Table 3 .

Political Mechanism

Harmonize independent assessments and metrics with the GHSA and the OIE's PVS Pathways.

The WHO in collaboration with the GHSA and the OIE Why:

Harmonization will ensure a One Health strategy and reduce redundancies for governments exposed to multiple evaluations. WHA understandings or addition of an annex to the IHR Parallel initiatives such as the GHSA and OIE's Performance of Veterinary Services (PVS) Pathways (measuring compliance with OIE standards on veterinary services) should be harmonized with the IHR. The IHR are the only agreement with the international legal and political legitimacy to set global security standards. Harmonizing extant multiple standards within the IHR would be more holistic, ensuring a One Health strategy and reducing redundancies for governments exposed to multiple evaluations.

States often resist external assessment due to sovereignty concerns, but the new system could be designed to foster cooperation. Evaluation teams would comprise both domestic and external experts, so national governments would be fully involved in the process. WHO, regional, and country offices would all play a strategic role. Civil society should be fully engaged, much like in UNAIDS monitoring mechanisms. Expert panels would work constructively and collaboratively to identify capacity gaps, develop a road map, and identify funding sources to achieve measurable benchmarks for success. The mandate, therefore, would not be to give a passing or failing grade but to continuously improve health infrastructure with strategic plans and adequate financing.

The World Bank's Pandemic Emergency Facility (PEF) should tie funding to country cooperation with IHR assessments. Additionally, international donors such as regional development banks, the Global Fund, and philanthropies could create funding streams for national IHR core capacities, also conditioned upon rigorous assessments. All of these measures would reinforce national commitments to build robust health systems, which align well with the UN Sustainable Development Goal of Universal Health Coverage (UHC). 53 ""What gets measured gets done."" But Laud Boateng, a GHSA Next Generation Fellow from Ghana, shifts this discourse to better reflect national experiences noting, ""what gets measured gets done, but only what gets political support gets measured, and only that which is funded gets political support."" 54 Thus, tying independent evaluations to external funding would foster cooperation and marshal resources for building core capacities.

Robust financing is required not only to build national health systems but also to support the WHO's own capacities and to ensure a surge in resources in a health emergency. Several financing models could operate separately or in concert. Increasing WHO Member State-assessed contributions would be the most logical funding source. Mandatory dues are more predictable and sustainable than discretionary funding for targeted projects. Moreover, as the treaty oversight agency, the WHO holds the legal obligation to implement the regulations, including securing adequate financing.

Assessed dues, however, are politically fraught. Several high-income Member States do not have sufficient confidence in the agency to justify an increase in their dues. They also want the discretion to direct where their international assistance is going. Consequentially, it will be necessary to create alternative financing mechanisms. The GHSA Action Packages and the PEF are realistic funding sources, but they should be synchronized with the IHR. The Global Fund offers another model, whereby the WHO and the World Bank could host a donors' conference to boost international support and cooperation. 2, 55 Irrespective of the funding mechanism, ensuring sustainable resources to develop and maintain core capacities would benefit both low-and high-income countries by strengthening security for all.

Ebola demonstrated that a well-trained, well-equipped health workforce is crucial to an effective response, including doctors, nurses, community health workers, lab technicians, infection control practitioners, and public health experts. If there are insufficient health personnel and their numbers are depleted even further by exposure to infection, the health system will fail to control outbreaks. Educating, training, supporting, and protecting health workers is a defining issue for global health security.

Even a well-prepared workforce may not be able to cope in a public health emergency. In such cases, the WHO must make provision for a surge in human resources, such as through the Global Outbreak Alert and Response Network (GOARN). The 2015 WHA endorsed a Global Health Reserve Workforce but failed to guarantee funding.

AIDS advocates demonstrated the power of civil society to demand global health equity. 56 Civil society organizations (CSOs) care for their communities, monitor governments, and hold stakeholders to account. As with other spheres of international law, such as in human rights or climate change, civil society could offer ""shadow"" reports and advocate for funding national capacities and fulfilling IHR and human rights obligations. Harnessing the power of CSOs requires more than incorporating them into existing or new IHR functions. Borrowing from the Framework Convention on Tobacco Control, the WHO could regularly host a Conference of the Parties where civil society could meet with governments to advance IHR implementation. The Framework Convention Alliance (CSOs committed to effective implementation of the Framework Convention on Tobacco Control) has propelled tobacco control reforms. A similar CSO network for IHR implementation could be transformative.

After facing criticism for disclosing Emergency Committee members only after the H1N1 PHEIC was terminated, the WHO improved public trust by releasing member names for subsequent Emergency and Review Committees. 25(p16) The WHO also pledged transparency on expert committee members' conflicts of interest. 57 Concerns still persist, however, that Emergency Committees are influenced by politics rather than strictly scientific evidence. For example, the D-G and Emergency Committee offered no evidence for their decisions regarding H1N1, 25 very little for the first Emergency Committee meeting on Ebola, 29 and little during the initial meetings on MERS. 58 They did give more transparent explanations for polio 59 and recent MERS and Zika Emergency Committees. 60 The D-G and Emergency Committee should routinely publicly disclose their evidence and decision-making processes. Transparency would include full minutes of Emergency Committee meetings, web access to relevant documents, and live updates through social media platforms.

Independent and transparent Emergency Committee decision making would build public confidence, but these reforms are of little value if the D-G fails to convene an Emergency Committee. Outside the WHO's governing structure and drawing on civil society shadow reports, a committee of independent experts, particularly from academia and civil society, could coalesce to regularly review data on disease outbreaks and propose actions, including recommending that the D-G convene an Emergency Committee.

The declaration of a PHEIC is the public face of the WHO's outbreak response, but the agency must respond long before an outbreak becomes an international emergency. Beyond the IHR, the WHO has multiple instruments supporting early action. For example, the WHO utilizes the Emergency Response Framework (ERF) to measure the level of risk and to inform the international community of an outbreak's severity in a graduated manner. 61 As evidenced during the Ebola epidemic, using 2 distinct sets of governing rules (the ERF and the IHR) confused first responders and the public. Similar confusion arose during the H1N1 pandemic, in which the WHO did not coordinate the 6 pandemic phases in the Pandemic Influenza Preparedness and Response Framework 62 (since revised) with the PHEIC. Given the public symbolism of a PHEIC, multiple emergency response frameworks must be integrated with IHR processes.

The WHO Ebola Interim Assessment Panel recommended introducing an intermediate-level emergency-allowing gradation while retaining the power of a PHEIC. 2 A gradient system would not necessarily require a textual amendment to the IHR, as many diplomats fear. The WHO could develop informal guidelines through Article 11, which allows the agency to share information with States Parties, alerting them to potential emergencies in a graduated fashion. Alternatively, the WHA could adopt a new IHR annex that illustrates the risk gradient, limiting negotiations only to the new annex. To maintain credibility, different grades should trigger clear operational and financial strategies. For example, an intermediate-level emergency could allow the WHO to access resources from the Contingency Fund. Similarly, the World Bank could release PEF funds based on graded emergency declarations by the WHO. 63 The promise of international assistance with adequate funding, even at an early stage, could provide additional incentives for States Parties to report a potential PHEIC through the Annex 2 algorithm. A full PHEIC declaration, however, would still be needed to raise the global alert, stiffen political resolve, and mobilize major resources.

State disregard for Article 43's ""Additional Health Measures"" and Emergency Committee temporary recommendations (eg, state travel and trade restrictions and injudicious quarantines) undermines the IHR. For example, during H1N1 and Ebola, States Parties ignored WHO recommendations and imposed additional measures, impeding deployment of critical medical supplies and health workers. Regional and international carriers suspended flights; States Parties banned travel to and from, or trade with, affected countries; and quarantines of health workers returning from the region dampened the charitable instinct to help.

The WHO is not a policing agency that can readily impose sanctions on States Parties for noncompliance with their legal obligations. But it does have various means at its disposal to enhance compliance, which it has failed to use. The D-G should publicly request clear rationales for and reconsideration of additional measures, while working with States Parties to dismantle harmful policies. The D-G could more actively encourage States Parties to pursue available dispute mediation and arbitration under Article 56 (3) . She could similarly steer States Parties toward the Permanent Court of Arbitration Optional Rules for Arbitrating Disputes Between Two States. The WHO and the World Trade Organization (WTO) could similarly encourage use of the WTO Dispute Resolution procedures by States Parties harmed by additional measures. Although the WTO is primarily constituted to adjudicate WTO treaties, it could intervene in cases where state action adversely impacts both public health and international trade-such as a poultry ban during H5N1 outbreaks.

Beyond the WTO, other institutions could encourage IHR compliance. For example, at various points during the H1N1 pandemic, the FAO, OIE, and WTO together with the WHO issued joint statements discouraging trade restrictions on pork and pigs. 64, 65 It may also be possible to look to the International Court of Justice (ICJ) when one country's active violation of the IHR causes specific damage to either the population or the economy of a second country.

There is still more the WHO could do to signal strong political commitment to IHR compliance. The WHA, for example, could amend Article 48 to elevate temporary recommendations from the Emergency Committee during a PHEIC to a binding status. Even though States Parties could still disregard their international obligations, more binding treaty language could increase pressure to comply.

Textual reforms are more difficult to achieve than operational reforms. Reopening the full text of the IHR for revision would result in a multiyear negotiating process and require considerable resources and could weaken IHR norms and human rights safeguards. Our proposals for reform, therefore, should be achieved, whenever possible, by textual interpretation, understandings, and amendments to specific annexes, rather than the main text.

There is a precedent for amending an IHR annex without reopening the entire text to negotiation (2014 Resolution regarding Annex 7 and Yellow Fever). 66 States Parties could find consensus on new language or understandings focused only on particular annexes. Revisions to the main text through textual interpretations or understandings would be politically feasible. In arms control treaties, for example, States Parties use the mechanism of Review Conferences to agree on a series of understandings to guide treaty implementation and State Party compliance. The States Parties decide specifically not to reopen the original text to revision. IHR States Parties could adopt similarly effective political strategies, fully consistent with international law. ""Smart"" global health diplomacy could enhance IHR functioning without bureaucratic hurdles standing in the way of sensible reform.

Ten years after the adoption of the IHR, it is time to realize their promise. The unconscionable Ebola epidemic in West Africa opened a window of opportunity for fundamental reform-for both the IHR and the Organization that oversees the treaty. That political window, however, is rapidly closing. Donor fatigue, fading memories, and competing priorities (eg, climate change, the Paris bombings, and fighting the Islamic State) are diverting political attention. The promising results of the vaccine trial Ebolaça Suffit (""Ebola that's enough""), 67 although transformative, could further weaken political resolve. Empowering the WHO and realizing the IHR's potential would shore up global health security-a vital investment in human and animal health, while reducing the vast economic consequences of the next global health emergency.

",0.7855711030656263
