title,text,authors,publish_time,url
N95 filtering facepiece respirators do not reliably afford respiratory protection during chest compression: A simulation study," In addition, HCWs engaging in chest compression of patients with airborne diseases could wear powered air-purifying respirators with hoods (PAPRs) rather than N95 respirators","Hwang, Sung Yeon; Yoon, Hee; Yoon, Aerin; Kim, Taerim; Lee, Guntak; Jung, Kwang Yul; Park, Joo Hyun; Shin, Tae Gun; Cha, Won Chul; Sim, Min Seob; Kim, Seonwoo",2020-01-31,https://doi.org/10.1016/j.ajem.2019.03.041
User acceptance of reusable respirators in health care," EHFR, elastomeric half-face respirator; N95-FFR, N95 filtering facepiece respirator; PAPR, powered air-purifying respirator","Hines, Stella E.; Brown, Clayton; Oliver, Marc; Gucer, Patricia; Frisch, Melissa; Hogan, Regina; Roth, Tracy; Chang, James; McDiarmid, Melissa",2019-06-30,https://doi.org/10.1016/j.ajic.2018.11.021
Self-contamination during doffing of personal protective equipment by healthcare workers to prevent Ebola transmission," The whole outfit includes double gloves, boots, disposable face shield and an N95 respirator","Suen, Lorna K. P.; Guo, Yue Ping; Tong, Danny W. K.; Leung, Polly H. M.; Lung, David; Ng, Mandy S. P.; Lai, Timothy K. H.; Lo, Kiki Y. K.; Au-Yeung, Cypher H.; Yu, Winnie",2018-12-22,https://www.ncbi.nlm.nih.gov/pmc/articles/PMC6303998/
The efficacy of medical masks and respirators against respiratory infection in healthcare workers," Respirators are designed to provide respiratory protection through filtration and fit, and properly fitted respirators provide better protection compared to medical masks","MacIntyre, Chandini Raina; Chughtai, Abrar Ahmad; Rahman, Bayzidur; Peng, Yang; Zhang, Yi; Seale, Holly; Wang, Xiaoli; Wang, Quanyi",2017-08-30,https://www.ncbi.nlm.nih.gov/pmc/articles/PMC5705692/
Resistance to synthetic blood penetration of National Institute for Occupational Safety and Health-approved N95 filtering facepiece respirators and surgical N95 respirators, FDA clears only a small percentage of NIOSHapproved N95 FFRs as surgical N95 respirators,"Rengasamy, Samy; Sbarra, Deborah; Nwoko, Julian; Shaffer, Ronald",2015-11-01,https://doi.org/10.1016/j.ajic.2015.06.014
Commentary Considerations for Recommending Extended Use and Limited Reuse of Filtering Facepiece Respirators in Health Care Settings,The most commonly used type of respirator in health care settings are NIOSH certified N95 filtering facepiece respirators (FFRs),"Fisher, Edward M.; Shaffer, Ronald E.",2014-03-14,http://europepmc.org/articles/pmc4610368?pdf=render
Evaluation of the survivability of MS2 viral aerosols deposited on filtering face piece respirator samples incorporating antimicrobial technologies, One of them was a NIOSH-approved P95 particulate respirator,"Rengasamy, Samy; Fisher, Edward; Shaffer, Ronald E.",2010-02-28,https://doi.org/10.1016/j.ajic.2009.08.006
Stockpile of personal protective equipment in hospital settings: Preparedness for influenza pandemics," According to this system, the total number of PPE is 10,528 N95 respirators (with exhalation valve), 8848 N95 respirators, 122,192 surgical masks, 21,280 goggles and gowns, 34,832 aprons, and 172,480 pairs of gloves","Hashikura, Mayuko; Kizu, Junko",2009-11-30,https://doi.org/10.1016/j.ajic.2009.05.002
