title,text,authors,publish_time,url
User acceptance of reusable respirators in health care," Thus, the health care sector must plan to address these foreseeable shortages","Hines, Stella E.; Brown, Clayton; Oliver, Marc; Gucer, Patricia; Frisch, Melissa; Hogan, Regina; Roth, Tracy; Chang, James; McDiarmid, Melissa",2019-06-30,https://doi.org/10.1016/j.ajic.2018.11.021
Commentary Considerations for Recommending Extended Use and Limited Reuse of Filtering Facepiece Respirators in Health Care Settings," OSHA develops and enforces workplace regulations on respiratory protection
 NIOSH certifies respirators and develops recommendations on the use of respiratory protection in health care workplaces to protect workers
 There is also a general lack of awareness among infection control professionals and safety/ employee health administrators in understanding FDA's role in regulating surgical N95 respirators
While OSHA is responsible for regulating employers to provide a safe workplace for their employees and CDC makes public health recommendations that are often adopted by hospitals, FDA has a different role in health care settings","Fisher, Edward M.; Shaffer, Ronald E.",2014-03-14,http://europepmc.org/articles/pmc4610368?pdf=render
Internet-based surveillance systems for monitoring emerging infectious diseases, A global response requires concerted international approaches to strengthen the capacity of emerging infectious diseases surveillance systems worldwide,"Milinovich, Gabriel J; Williams, Gail M; Clements, Archie C A; Hu, Wenbiao",2014-02-28,https://doi.org/10.1016/s1473-3099(13)70244-5
Health care workers' perceptions of respiratory and gastrointestinal algorithms for patient management in emergency care settings,The current study advances knowledge surrounding HCWs perceptions of organizational-specific guidelines for managing patients with suspected communicable respiratory and GI illnesses in emergency departments,"Siow, Serena; Bryce, Elizabeth A.; Scharf, Sydney",2009-11-30,https://doi.org/10.1016/j.ajic.2009.03.007
"The individual, environmental, and organizational factors that influence nurses' use of facial protection to prevent occupational transmission of communicable respiratory illness in acute care hospitals"," Reinforcing factors are organizational factors such as communication, policies and procedures, and management commitment to health and safety","Nichol, Kathryn; Bigelow, Philip; O'Brien-Pallas, Linda; McGeer, Allison; Manno, Mike; Holness, D. Linn",2008-09-30,https://doi.org/10.1016/j.ajic.2007.12.004
