title,text,authors,publish_time,url
Physiologic and other effects and compliance with long-term respirator use among medical intensive care unit nurses," Future studies should also examine other factors that may help increase health care personnel tolerance of long-term N95 usage
 Noncompliance with N95 use can put staff at risk from infection, a factor believed to be associated with the high rate of severe acute respiratory syndrome among health care personnel","Rebmann, Terri; Carrico, Ruth; Wang, Jing",2013-12-31,https://doi.org/10.1016/j.ajic.2013.02.017
Health care workers' perceptions of respiratory and gastrointestinal algorithms for patient management in emergency care settings,Health care workers' perceptions of respiratory and gastrointestinal algorithms for patient management in emergency care settings Patients presenting with respiratory or gastrointestinal illness in emergency care settings are often not yet diagnosed but are potentially capable of transmitting disease,"Siow, Serena; Bryce, Elizabeth A.; Scharf, Sydney",2009-11-30,https://doi.org/10.1016/j.ajic.2009.03.007
"The individual, environmental, and organizational factors that influence nurses' use of facial protection to prevent occupational transmission of communicable respiratory illness in acute care hospitals","The individual, environmental, and organizational factors that influence nurses' use of facial protection to prevent occupational transmission of communicable respiratory illness in acute care hospitals Background: Communicable respiratory illness is an important cause of morbidity among nurses
 Communicable respiratory illness is an important cause of morbidity among health care workers each year
 One qualitative study found that media coverage of HIV and hepatitis B was an important factor in health care workers' compliance with universal precautions","Nichol, Kathryn; Bigelow, Philip; O'Brien-Pallas, Linda; McGeer, Allison; Manno, Mike; Holness, D. Linn",2008-09-30,https://doi.org/10.1016/j.ajic.2007.12.004
Evaluation of the rationale for concurrent use of N95 filtering facepiece respirators with loose-fitting powered air-purifying respirators during aerosol-generating medical procedures, Published reports from the health care environment suggest that PAPRs alone offer sufficiently high levels of respiratory protection during aerosolizing medical procedures,"Roberge, Raymond J.",2008-03-31,https://doi.org/10.1016/j.ajic.2007.04.284
Protecting health care workers from SARS and other respiratory pathogens: Organizational and individual factors that affect adherence to infection control guidelines," The lessons learned from SARS should be used to improve occupational health and safety for health care workers for current nosocomially transmitted infections, as well as for future potential emerging diseases","Moore, David; Gamage, Bruce; Bryce, Elizabeth; Copes, Ray; Yassi, Annalee; other members of The BC Interdisciplinary Respiratory Protection Study Group, ",2005-03-31,https://doi.org/10.1016/j.ajic.2004.11.003
